{"format":"erg-patch/1","stem":"synthetic_s12","title":"Synthetic 12","base":{"key":"Multi.Synthetic","source":"game","sha256":{"xan":"aaaaaaaaaaaaaaaaaaaaaaaaaaaaaaaaaaaaaaaaaaaaaaaaaaaaaaaaaaaaaaaa","xom":"bbbbbbbbbbbbbbbbbbbbbbbbbbbbbbbbbbbbbbbbbbbbbbbbbbbbbbbbbbbbbbbb","hmp":"cccccccccccccccccccccccccccccccccccccccccccccccccccccccccccccccc"}},"databank":{},"water":{"level":null},"spawns":{"mode":"random"},"hmp":{"mode":"copy"},"ops":[{"op":"voxels","frame":4,"runs":[[62,1,35204],[63,1,136],[74,1,37260],[75,1,144],[76,1,40344],[78,1,43428],[79,1,168],[90,1,45484],[91,1,176]]},{"op":"voxels","frame":5,"runs":[[32,1,31],[39,1,31]]},{"op":"voxels","frame":6,"runs":[[283,1,51],[336,2,51],[399,2,4456499],[401,1,4505907],[407,3,51],[410,1,52531],[411,1,51],[417,2,51],[462,1,51],[480,2,51],[482,1,60723],[535,1,51]]},{"op":"voxels","frame":7,"runs":[[55,1,131],[75,1,139],[79,1,163],[99,1,171]]},{"op":"voxels","frame":8,"runs":[[0,1,9504],[1,1,36],[2,1,40],[3,1,12588],[6,1,15672],[7,1,60],[9,1,18756],[10,1,72],[11,1,76],[12,1,8148304],[15,1,24924],[16,1,96],[18,1,28008],[19,1,108],[20,1,112],[21,1,31092],[24,1,16287104],[25,1,16253060],[27,1,37260],[28,1,144],[29,1,148],[30,1,40344],[33,1,43428],[34,1,168],[36,1,14644],[39,1,2114880],[40,1,2097220],[42,1,20812],[43,1,80],[44,1,84],[45,1,23896],[48,1,26980],[49,1,104],[51,1,10253680],[52,1,10223732],[53,1,10223736],[54,1,33148],[57,1,36232],[58,1,140],[60,1,39316],[61,1,152],[62,1,156],[63,1,1615264],[66,1,45484],[67,1,176],[69,1,48568],[70,1,188],[71,1,192],[72,1,19784],[73,1,76],[75,1,22868],[76,1,88],[77,1,92],[78,1,4220256],[81,1,29036],[82,1,112],[84,1,32120],[85,1,124],[86,1,128],[87,1,35204],[90,1,12359056],[91,1,12320916],[93,1,41372],[94,1,160],[95,1,164],[96,1,44456],[99,1,47540],[100,1,184],[102,1,3720640],[103,1,3670212],[104,1,3670216],[105,1,53708],[108,1,24924],[109,1,96],[110,1,100],[111,1,28008],[114,1,31092],[115,1,120],[117,1,6325632],[118,1,6291588],[119,1,6291592],[120,1,37260],[123,1,40344],[124,1,156],[126,1,43428],[127,1,168],[128,1,172],[129,1,14464432],[132,1,49596],[133,1,192],[135,1,52680],[136,1,204],[137,1,208],[138,1,55764],[141,1,5826016],[142,1,5767396],[144,1,292208],[147,1,33148],[148,1,128],[150,1,36232],[151,1,140],[152,1,144],[153,1,39316],[156,1,8431008],[157,1,8388772],[159,1,45484],[160,1,176],[161,1,180],[162,1,48568],[165,1,51652],[166,1,200],[168,1,16569808],[169,1,16515284],[170,1,16515288],[171,1,57820],[174,1,60904],[175,1,236],[177,1,63988],[178,1,248],[179,1,252],[180,1,35204],[181,1,136],[183,1,2397584],[184,1,2359444],[185,1,2359448],[186,1,41372],[189,1,44456],[190,1,172],[192,1,47540],[193,1,184],[194,1,188],[195,1,10536384],[198,1,53708],[199,1,208],[201,1,56792],[202,1,220],[203,1,224],[204,1,59876],[207,1,1897968],[208,1,1835252],[210,1,508],[211,1,0],[212,1,4],[213,1,3336],[216,1,40344],[217,1,156],[218,1,160],[219,1,43428],[222,1,4502960],[223,1,4456628],[225,1,49596],[226,1,192],[227,1,196],[228,1,52680],[231,1,55764],[232,1,216],[234,1,12641760],[235,1,12583140],[236,1,12583144],[237,1,61932],[240,1,65016],[241,1,252],[243,1,2308],[244,1,8],[245,1,12],[246,1,3937552],[249,1,8476],[250,1,32],[252,1,45484],[255,1,48568],[256,1,188],[258,1,51652],[259,1,200],[260,1,204],[261,1,6608336],[264,1,57820],[265,1,224],[267,1,60904],[268,1,236],[269,1,240],[270,1,63988],[273,1,14681344],[274,1,14680068],[276,1,4364],[277,1,16],[278,1,20],[279,1,7448],[282,1,10532],[283,1,40],[285,1,6042928],[286,1,6029364],[287,1,6029368],[288,1,574912],[289,1,524484],[291,1,53708],[292,1,208],[293,1,212],[294,1,56792],[297,1,59876],[298,1,232],[300,1,8713712],[301,1,8650996],[302,1,8651000],[303,1,508],[306,1,3336],[307,1,12],[309,1,6420],[310,1,24],[311,1,28],[312,1,9504],[315,1,12588],[316,1,48],[318,1,15672],[319,1,60],[320,1,64],[321,1,18756],[324,1,55764],[325,1,216],[326,1,220],[327,1,2680288],[330,1,61932],[331,1,240],[333,1,65016],[334,1,252],[335,1,0],[336,1,2308],[339,1,10753296],[340,1,10747924],[342,1,8476],[343,1,32],[344,1,36],[345,1,11560],[348,1,14644],[349,1,56],[351,1,2114880],[352,1,2097220],[353,1,2097224],[354,1,20812],[357,1,23896],[358,1,92],[360,1,60904],[363,1,63988],[364,1,248],[366,1,4719872],[367,1,4718596],[368,1,4718600],[369,1,4364],[372,1,7448],[373,1,28],[375,1,10532],[376,1,40],[377,1,44],[378,1,12858672],[381,1,16700],[382,1,64],[384,1,19784],[385,1,76],[386,1,80],[387,1,22868],[390,1,4220256],[391,1,4194404],[393,1,29036],[394,1,112],[395,1,116]]},{"op":"voxels","frame":9,"runs":[[10,1,68],[13,1,76],[14,1,80],[37,1,96],[38,1,100],[39,1,104],[41,1,108],[42,1,112],[66,1,132]]},{"op":"voxels","frame":10,"runs":[[544,3,31],[554,3,31],[654,3,31]]},{"op":"voxels","frame":11,"runs":[[9,1,51],[17,3,8126515],[34,1,2097203],[37,2,51],[40,1,26931],[41,1,51],[50,1,10223667],[65,3,4194355],[69,2,51],[73,1,51]]},{"op":"voxels","frame":12,"runs":[[174,3,131],[195,2,171],[294,3,163],[304,3,163],[424,3,195],[434,3,195]]},{"op":"voxels","frame":13,"runs":[[2,1,60],[3,1,64],[4,1,68],[11,1,72],[29,1,96],[30,1,100],[31,1,104],[32,1,29036],[33,1,112],[38,1,8126572],[39,1,8126576],[40,1,8126580],[41,1,8158584],[47,1,120],[48,1,124],[65,1,144],[66,1,148],[67,1,152],[68,1,41372],[69,1,160],[74,1,16253084],[75,1,16253088],[76,1,16253092],[77,1,16297384],[78,1,16253100],[83,1,168],[84,1,172],[85,1,176],[92,1,80],[93,1,84],[94,1,88],[95,1,24924],[96,1,96],[101,1,2097244],[102,1,2097248],[103,1,2097252],[104,1,2125160],[105,1,2097260],[110,1,104],[111,1,108],[112,1,112],[119,1,116],[137,1,10223756],[138,1,10223760],[139,1,10223764],[140,1,10263960],[141,1,10223772],[146,1,152],[147,1,156],[148,1,160],[149,1,43428],[155,1,164],[156,1,168],[173,1,1573052],[174,1,1573056],[175,1,1573060],[176,1,1625544],[177,1,1573068],[182,1,100],[183,1,104],[200,1,4194428],[201,1,4194432],[202,1,4194436],[203,1,4230536],[204,1,4194444],[209,1,136],[210,1,140],[211,1,144],[212,1,39316],[213,1,152],[218,1,148],[219,1,152],[220,1,156],[227,1,160],[245,1,184],[246,1,188],[247,1,192],[248,1,51652],[249,1,200],[254,1,196],[255,1,200],[256,1,204],[257,1,54736],[263,1,208],[264,1,212],[272,1,120],[273,1,124],[274,1,128],[275,1,35204],[276,1,136],[281,1,132],[282,1,136],[283,1,140],[284,1,38288],[290,1,144],[291,1,148],[308,1,168],[309,1,172],[310,1,176],[311,1,47540],[312,1,184],[317,1,180],[318,1,184],[319,1,188],[320,1,50624],[321,1,196],[326,1,192],[327,1,196],[328,1,200],[335,1,14418124],[353,1,228],[354,1,232],[355,1,236],[356,1,62960],[357,1,244],[362,1,262284],[380,1,164],[381,1,168],[382,1,172],[383,1,46512],[384,1,180],[389,1,176],[390,1,180],[391,1,184],[392,1,49596],[398,1,8388796],[399,1,8388800],[416,1,212],[417,1,216],[418,1,220],[419,1,58848],[420,1,228],[425,1,224],[426,1,228],[427,1,232],[428,1,61932],[429,1,240],[434,1,16515308],[435,1,16515312],[436,1,16515316],[443,1,248],[452,1,160],[453,1,164],[454,1,168],[455,1,45484],[456,1,176],[461,1,2359468],[462,1,2359472],[463,1,2359476],[470,1,184],[488,1,208],[489,1,212],[490,1,216],[491,1,57820],[492,1,224],[497,1,10485980],[498,1,10485984],[499,1,10485988],[500,1,10546664],[506,1,232],[507,1,236],[524,1,0],[525,1,4],[526,1,8],[527,1,4364],[528,1,16],[533,1,1835020],[534,1,1835024],[535,1,1835028],[536,1,1842456],[537,1,1835036],[551,1,192],[552,1,196],[553,1,200],[554,1,53708],[555,1,208],[560,1,4456652],[561,1,4456656],[562,1,4456660],[563,1,4513240],[564,1,4456668],[569,1,216],[570,1,220],[571,1,224],[578,1,228],[596,1,12583164],[597,1,12582912],[598,1,12582916],[599,1,12586248],[600,1,12582924],[605,1,8],[606,1,12],[607,1,16],[608,1,6420],[614,1,20],[615,1,24],[632,1,200],[633,1,204],[634,1,208],[635,1,55764],[641,1,212],[642,1,216],[659,1,6553836],[660,1,6553840],[661,1,6553844],[662,1,6618616],[663,1,6553852],[668,1,248],[669,1,252],[670,1,0],[671,1,2308],[672,1,8],[677,1,4],[678,1,8],[679,1,12],[686,1,16],[704,1,40],[705,1,44],[706,1,48],[707,1,14644],[708,1,56],[713,1,52],[714,1,56],[715,1,60],[716,1,17728],[731,1,232],[732,1,236],[733,1,240],[734,1,63988],[735,1,248],[740,1,244],[741,1,248],[742,1,252],[743,1,1280],[749,1,0],[750,1,4],[767,1,24],[768,1,28],[769,1,32],[770,1,10532],[771,1,40],[776,1,36],[777,1,40],[778,1,44],[779,1,13616],[780,1,52],[785,1,48],[786,1,52],[787,1,56],[794,1,60],[812,1,240],[813,1,244],[814,1,248],[821,1,2621692],[839,1,20],[840,1,24],[841,1,28],[842,1,9504],[843,1,36],[848,1,32],[849,1,36],[850,1,40],[851,1,12588],[857,1,10747948],[858,1,10747952],[875,1,68],[876,1,72],[877,1,76],[878,1,21840],[879,1,84],[884,1,80],[885,1,84],[886,1,88],[887,1,24924],[888,1,96],[893,1,2097244],[894,1,2097248],[895,1,2097252]]},{"op":"voxels","frame":14,"runs":[[27,1,39316],[28,1,152],[30,1,41372],[31,1,160],[33,1,2403752],[34,1,2359468],[35,1,2359472],[37,1,180],[39,1,49596]]},{"op":"voxels","frame":15,"runs":[[29,1,31],[51,1,31]]}]}
