{
  "format": "erg-patch/1",
  "stem": "erg_sample_sample",
  "title": "Erg Sample: High Water",
  "base": {
    "key": "Multi.DinerMight",
    "source": "game",
    "sha256": {
      "xan": "437930a808c1a1a0f3bff4a5abd0592af17396b32228afc6834e43414bb6f133",
      "xom": "c058899dcf0d4893de046cf78ced241afd07c22046d3b0ece09a933cbe8d525f",
      "hmp": "13d4308a55def0d8c9b150f55b1d2da6c0b198f1d2decbc012775e62a6d7fec2"
    }
  },
  "water": { "level": 25.0 },
  "spawns": { "mode": "knots" },
  "hmp": { "mode": "copy" },
  "ops": [
    { "op": "set", "src": 112, "pos": [3.62, 19.6, 7.4] },
    { "op": "set", "src": 113, "pos": [-1.44, 18.68, -5.52] },
    { "op": "set", "src": 114, "pos": [5.02, 20.1, -16.52] },
    { "op": "set", "src": 115, "pos": [-14.128, 19.3, 6.83] },
    { "op": "set", "src": 116, "pos": [-31.98, 28.82, 5.34] },
    { "op": "set", "src": 117, "pos": [-27.8, 19.68, -12.62] },
    { "op": "set", "src": 118, "pos": [-47.218, 22.24, 13.232] },
    { "op": "set", "src": 119, "pos": [-43.56, 21.32, -10.2] }
  ]
}
