{"format":"erg-patch/1","stem":"mymaps_synthetic","title":"Synthetic Brawl","base":{"key":"Multi.Synthetic","source":"game","sha256":{"xan":"aaaaaaaaaaaaaaaaaaaaaaaaaaaaaaaaaaaaaaaaaaaaaaaaaaaaaaaaaaaaaaaa","xom":"bbbbbbbbbbbbbbbbbbbbbbbbbbbbbbbbbbbbbbbbbbbbbbbbbbbbbbbbbbbbbbbb","hmp":"cccccccccccccccccccccccccccccccccccccccccccccccccccccccccccccccc"}},"databank":{"theme":"CAMELOT"},"water":{"level":40},"spawns":{"mode":"knots"},"hmp":{"mode":"copy"},"ops":[{"op":"set","src":16,"pos":[12.5,3,-4]},{"op":"add","frame":3,"detail":{"name":"oildrum","resource":"OilDrum","pos":[1,2,3]}},{"op":"remove","src":25}]}
